{
  "$schema": "https://json-schema.org/draft/2020-12/schema",
  "$id": "https://github.com/Yumeno/Quality-gate-builder/schemas/gate.runtime.schema.json",
  "title": "qgb gate report (volatile, permissive)",
  "description": "Schema for gate.json under artifacts/.../runs/<timestamp>/. Same required fields as curated, but additionalProperties allowed for future expansion.",
  "type": "object",
  "additionalProperties": true,
  "required": [
    "schema_version",
    "req_id",
    "timestamp_utc",
    "timestamp_rfc3339",
    "run_id",
    "phase",
    "status",
    "failed_stage",
    "decision",
    "runner",
    "paths",
    "stages",
    "basis"
  ],
  "properties": {
    "schema_version": {
      "type": "string",
      "pattern": "^[0-9]+\\.[0-9]+$"
    },
    "req_id": {
      "type": "string",
      "pattern": "^REQ-[A-Z0-9]+-[0-9]{3,}$"
    },
    "mode": {
      "type": "string",
      "enum": ["check"],
      "description": "Phase 2 Step 2.4: present (value 'check') only on gates produced by 'qgb check'. Official 'qgb run' gates omit this field (absence = official). When mode=check, paths.curated_latest_dir must be absent (see allOf)."
    },
    "timestamp_utc": {
      "type": "string",
      "description": "Compact UTC timestamp (wall-clock truth, seconds precision): YYYY-MM-DDTHHMMSSZ. Same instant as timestamp_rfc3339. paths.run_dir uses <timestamp_utc>-<run_id> so collisions are absorbed by run_id, not by walking timestamps forward.",
      "pattern": "^[0-9]{4}-(0[1-9]|1[0-2])-(0[1-9]|[12][0-9]|3[01])T(0[0-9]|1[0-9]|2[0-3])([0-5][0-9]){2}Z$"
    },
    "timestamp_rfc3339": {
      "type": "string",
      "format": "date-time"
    },
    "run_id": {
      "type": "string",
      "description": "Per-second monotonic counter ('r' + 4 hex digits, r0001..rffff) embedded in paths.run_dir. r0000 is reserved.",
      "pattern": "^r[0-9a-f]{4}$",
      "not": { "const": "r0000" }
    },
    "phase": {
      "type": "string",
      "enum": ["red", "green", "refactor", "verify"]
    },
    "status": {
      "type": "string",
      "enum": ["ALLOW", "DENY"]
    },
    "failed_stage": { "type": "string" },
    "decision": {
      "type": "object",
      "required": ["result", "meaning"],
      "properties": {
        "result": { "type": "string", "enum": ["ALLOW", "DENY"] },
        "meaning": { "type": "string", "minLength": 1 }
      },
      "additionalProperties": true
    },
    "runner": {
      "type": "object",
      "required": ["name", "version"],
      "properties": {
        "name": { "type": "string", "minLength": 1 },
        "version": { "type": "string", "minLength": 1 }
      },
      "additionalProperties": true
    },
    "paths": {
      "type": "object",
      "required": ["run_dir"],
      "properties": {
        "run_dir": {
          "type": "string",
          "minLength": 1,
          "description": "Trailing segment shape: <timestamp_utc>-<run_id> with run_id != r0000.",
          "pattern": "/[0-9]{4}-(0[1-9]|1[0-2])-(0[1-9]|[12][0-9]|3[01])T(0[0-9]|1[0-9]|2[0-3])([0-5][0-9]){2}Z-r(?!0000)[0-9a-f]{4}$"
        },
        "curated_latest_dir": { "type": "string", "minLength": 1 }
      },
      "additionalProperties": true
    },
    "stages": {
      "type": "array",
      "minItems": 1,
      "items": {
        "type": "object",
        "required": ["id", "name", "result", "verification_type"],
        "properties": {
          "id": { "type": "string", "minLength": 1 },
          "name": { "type": "string", "minLength": 1 },
          "result": {
            "type": "string",
            "enum": ["passed", "failed", "waived"],
            "description": "Step 2.4 補修 A3: 'waived' was added in Step 7 to the curated schema but this volatile schema had drifted (kept ['passed','failed']). A waived stage appears in every gate the runner writes — volatile runs/, curated latest/, and Step 2.4 check rehearsals (which exist ONLY in the volatile tree) — so the volatile schema must accept it too."
          },
          "verification_type": {
            "type": "string",
            "enum": [
              "command",
              "file_exists",
              "substring_match",
              "json_schema",
              "manual_check"
            ]
          },
          "exit_code": {
            "type": ["integer", "null"],
            "minimum": 0,
            "maximum": 255
          },
          "contract_ref": { "type": "string", "minLength": 1 },
          "log_ref": { "type": "string", "minLength": 1 }
        },
        "additionalProperties": true
      }
    },
    "basis": {
      "type": "array",
      "minItems": 1,
      "items": { "type": "string", "minLength": 1 },
      "uniqueItems": true
    }
  },
  "allOf": [
    {
      "description": "Official run gate (mode absent): paths.curated_latest_dir is required (Phase 1 invariant, byte-compatible with pre-mode gates).",
      "if": {
        "not": { "required": ["mode"] }
      },
      "then": {
        "properties": {
          "paths": { "required": ["curated_latest_dir"] }
        }
      }
    },
    {
      "description": "Check rehearsal gate (mode=check, Phase 2 Step 2.4): paths.curated_latest_dir must be ABSENT.",
      "if": {
        "required": ["mode"]
      },
      "then": {
        "properties": {
          "paths": {
            "not": { "required": ["curated_latest_dir"] }
          }
        }
      }
    },
    {
      "description": "ALLOW: failed_stage must be empty, decision.result must be ALLOW, every non-waived stage must have result=passed, and at least one passed stage must exist. Same semantic constraints as the curated schema (Step 2.4 補修 A3 で waived 対応の乖離を解消); only the additionalProperties policy differs.",
      "if": {
        "properties": { "status": { "const": "ALLOW" } },
        "required": ["status"]
      },
      "then": {
        "properties": {
          "decision": {
            "properties": { "result": { "const": "ALLOW" } }
          },
          "failed_stage": { "const": "" },
          "stages": {
            "items": {
              "properties": {
                "result": { "enum": ["passed", "waived"] }
              }
            },
            "contains": {
              "properties": { "result": { "const": "passed" } },
              "required": ["result"]
            }
          }
        }
      }
    },
    {
      "description": "DENY: decision.result must be DENY. Either a stage actually failed (failed_stage non-empty, at least one stage.result=failed) OR every adopted stage is waived (failed_stage empty, no stages.result=failed) — Step 7's 'no judgement material' branch, mirrored from the curated schema (Step 2.4 補修 A3).",
      "if": {
        "properties": { "status": { "const": "DENY" } },
        "required": ["status"]
      },
      "then": {
        "properties": {
          "decision": {
            "properties": { "result": { "const": "DENY" } }
          }
        },
        "oneOf": [
          {
            "description": "Normal DENY: a stage failed.",
            "properties": {
              "failed_stage": { "minLength": 1 },
              "stages": {
                "contains": {
                  "properties": { "result": { "const": "failed" } },
                  "required": ["result"]
                }
              }
            }
          },
          {
            "description": "All-waived DENY (Step 7): no judgement material. failed_stage is empty and no stage has result=failed.",
            "properties": {
              "failed_stage": { "const": "" },
              "stages": {
                "items": {
                  "properties": { "result": { "const": "waived" } }
                }
              }
            }
          }
        ]
      }
    }
  ]
}
